Q2.3,automation_doc_11,Industrial Developer,"Suggestions for naming fixes (cammelCase, underscore_). I often mix it up, because I happen to work with Qt that prefers cammelCase and C++ that is more fond of underscores."
Q2.3,automation_doc_12,Industrial Developer,A diff between the source and the documentation that listed definitions that needed to be written up in the documentation.
Q2.3,automation_doc_13,Other Occupation,"As regards comments, something that is able to properly determine the goal of the entity that needs to be commented; as regard naming something that is able to suggest a proper name to assign to an entity based on the naming conventions."
Q2.3,automation_doc_14,Senior Researcher,"in Terms of Java, I would expect that the tool could help generating the javadocs,  the license header, fix the naming conventions if possible, propose some comments (maybe templates), suggest the right modifiers. Pretty much everything."
Q2.3,automation_doc_15,Industrial Developer,extract real UML diagrammes from the code
Q2.3,automation_doc_16,CS Student,"Inconsistency check (e.g., suggest documentation edit when a related code fragment changed)"
Q2.3,automation_doc_17,CS Student,"fix function & class documentation, add basic documentation or make a suggestion"
Q2.3,automation_doc_18,Senior Researcher,None. Sorry. :)
Q2.3,automation_doc_19,Other Occupation,Both method and variable naming according to a project convention
Q2.3,automation_doc_20,Industrial Developer,Detection of the right places to put comments
Q2.3,automation_doc_21,Industrial Developer,"detection and auto-fix would be great, as they are usually related to recurrent problem, but again in some cases the detection of the problem would be already of great help for me. I do not want waste time of other developers with always the same issue, I think such a tool would make life of developers better."
Q2.3,automation_doc_22,Senior Researcher,"as explained before I  I would try to understand which problems are recurrent in code reviews, e.g.,  defining patterns and anti-patterns characterizing the ""software documentation"", then  defining solutions around it."
Q2.3,automation_doc_23,Senior Researcher,N.A
Q2.3,automation_doc_24,Industrial Developer,"I would expect  static tools profiling my changes in the documentation and providing me feedback encapsulating aspects related to coding or documentation styles. Clearly, even recommendations on the general required changes on a submitted patch would be really useful in my opinion."
Q2.3,automation_doc_25,Senior Researcher,tractability issue
Q2.3,automation_doc_26,Senior Researcher,"Correcting names, typos and modifiers"
Q2.3,automation_doc_27,Open Source Developer,"We require comprehensive, clear documentation and strict, simple coding style. We have our own Android code guidelines and use Android coding guidelines for contributors as a basis. Clean Code: A Handbook of Agile Software Craftsmanship (has recommendations on clean coding and code styling).
It would be great to have tools  able to answer the following questions automatically:
- did I have introduced imperfections at the level of documentation and coding style..?
Again, having the location (e.g., the set of files) where the problem was introduced would be relevant too.."
Q2.3,automation_doc_28,Industrial Developer,"Let me say that I would like automated feedback on production and test code for quality issues (e.g.,  structure, coverage, suggestions on how to refactoring production and test code, etc.), documentation & coding style and possibly performance issues; Performance and Security issues
From one side code and code changes metrics + code change patters 
would a useful information to study previous changes in the software and its documentation to learn more about upcoming (and recurrent) mistakes.
I would mine this information with some data mining techniques and machine learning to learn these patterns and/or identify some of the problems.
Ont top of this, I think auto-fixing strategies could be envisioned."
Q2.3,automation_doc_29,Senior Researcher,Maybe auto fill 
Q2.3,automation_doc_30,Open Source Developer,Lint on documentation formatting to match a style.  Tools like `markdownlint` or some spell/grammar checkers that work only on docs files or on code/docs files.
Q2.3,automation_doc_31,Industrial Developer,Naming inconsistencies like using snake case or camel case or pascal case in some variation.
Q2.3,automation_doc_32,Other Occupation,N
Q2.3,automation_doc_33,Industrial Developer,"i would use NLP parsing to detect recsurent issues, providing auto-fix solutions"
Q2.3,automation_doc_34,Industrial Developer,"there are many tools for detecting such issues, very few on proposing patches. Tools based on some text mining and nlp analysis to detect patterns used o correct mistakes in the documentation."
Q2.3,automation_doc_35,Industrial Developer,"for example,  detection and auto-fix are still not available for code review, but they should be suggested only when this is relevant for the review. Metrics based on static, dynamic analysis or detection strategies based on some nlp a alysis and similar approaches would be useful here I guess."
Q2.3,automation_doc_36,Industrial Developer,"i think tools like pmd, checkstyle alread y detect such problems, but are not always so accurate.."
Q2.3,automation_doc_37,Industrial Developer,"i think tools for this already exists, find bugs, pmd , checkstyles.."
Q2.3,automation_doc_38,Industrial Developer,"study with nlp, or other analysis recurrent patterns on how to write or not to write docs and provide potential fixes/solutions - the developers can keep the solutions they prefer"
Q2.3,automation_doc_39,Industrial Developer, autofixes
Q2.3,automation_doc_40,Industrial Developer,detection of recurrent problems and auto-fixes (or recommendation of potential solutions?)
Q2.3,automation_doc_41,Industrial Developer,Signaling when a function/class/object was incorrectly named and not found in the solution.
Q2.3,automation_doc_42,Industrial Developer,something that give me feedback on the quality of my documentation.
Q2.3,automation_doc_43,Industrial Developer,it would be fine to to have feedback on the documentation changes to perform
Q2.3,automation_doc_44,Industrial Developer,"a comprehensive tool highlighting the changes to to perform or the defects introduced in the documentation, while introducing (or evolving) my patch"
Q2.3,automation_doc_45,Industrial Developer,"I think documentation metrics, patterns or antipatterns in the code or in the documentation could be statically studied to determine things
-  to remove or changes (using the notion of antipatterns);
- things to add using the notion of patterns;
- detecting things that are inconsistent between documentation and the source code (this would be really useful in our continuous delivery pipeline)
"
Q2.3,automation_doc_46,CS Student,not sure about it.
Q2.3,automation_doc_47,Open Source Developer,not sure about this.
Q2.3,automation_doc_48,Industrial Developer,"automation on detecting and fixing recurrent and relevant documentation issues
for my organization"
Q2.3,automation_doc_49,Industrial Developer,  in all elements of the taxonomy
Q2.3,automation_doc_50,Industrial Developer,NA
Q2.3,automation_doc_51,Open Source Developer,do not know/do not want to say
Q2.3,automation_doc_52,Industrial Developer,there are tools like check styles and pmd for java
Q2.4,automation_style_1,Industrial Developer,"auto-formatting, fixing indent and tab/spaces - but that's not the concern of a code-review tool (we have code quality tools like sonarqube for that purpose)."
Q2.4,automation_style_2,Other Occupation,"I really do not understand the question; what do you mean by ""what kind of automation""? Sorry that I cannot be of any help here"
Q2.4,automation_style_3,Industrial Developer,"Formatting
Add missing annotations"
Q2.4,automation_style_4,Other Occupation,Full
Q2.4,automation_style_5,Senior Researcher,Most of these kind of issues should be automatically fixed by the automatic tool.
Q2.4,automation_style_6,CS Student,"consistend usage (eg. single line if statements) auto line break at max line length, linting for indention and white space usage, highlight TODO's"
Q2.4,automation_style_7,CS Student,"ALL OF THEM, at least recommend changes"
Q2.4,automation_style_8,Open Source Developer,"I actually think style automation is already developed pretty good consider tools like e.g. prettier, lint  and so"
Q2.4,automation_style_9,Senior Researcher,auto indentation tools
Q2.4,automation_style_10,Senior Researcher,"would be interesting to have a tool for evaluating my style consistency with respect to the whole project (the style applied in the organization). if checkstyle detect a style issue that is usually not remove in my organization, than, that warning is not a real issue. Style is something that is related to a specific project."
Q2.4,automation_style_11,Industrial Developer,I am not so much bothered by the Style issues. Most of them are quick to fix or the IDE (Qt Creator) already takes care of it.
Q2.4,automation_style_12,Industrial Developer,I feel like linters (e.g. eslint for Javascript) do a reasonable job of this. Making it easier for teams to add their own local rules would be helpful.
Q2.4,automation_style_13,Other Occupation,"Possibly, based on the output of static analysis tools try to automatically suggest a fix especially for brackets, indentation, blank lines and whitespaces"
Q2.4,automation_style_14,Senior Researcher,For the style? Everything should be automated. I think there are many tools already available to help on that (for example Jalopy?)
Q2.4,automation_style_15,Industrial Developer,I think this issue is already fixed by industrial tool such as Visual Stdio
Q2.4,automation_style_16,CS Student,"Fix linter style warnings (e.g., whitespace, blank lines) but don't remove TODO comments without user review !"
Q2.4,automation_style_17,CS Student,"make style suggestion if something could/can be improved, don't fix it automatically. "
Q2.4,automation_style_18,Senior Researcher,None. Sorry. :)
Q2.4,automation_style_19,Other Occupation,"I guess that this category is the easier one to fix, the I'll address mostly all of them"
Q2.4,automation_style_20,Industrial Developer,This can be done by placing a style checker in the process such that all developers obey the same style. 
Q2.4,automation_style_21,Industrial Developer,I think about style issues Checkstyle and similar tools are enough... while for other problem I'm not sure there are emerging and relevant tools for automating code review.
Q2.4,automation_style_22,Senior Researcher,"I think toolssuch as Checstyle already fix/handle such problems.

However, as explained before I  I would try to understand which problems are recurrent in code reviews, e.g.,  defining patterns and anti-patterns characterizing the ""code styles"", then  defining solutions around it."
Q2.4,automation_style_23,Senior Researcher,N.A
Q2.4,automation_style_24,Industrial Developer,"I would expect  static tools profiling my changes my code and providing me feedback encapsulating aspects related to coding styles or other aspects. Clearly, even recommendations on the general required changes on a submitted patch would be really useful in my opinion."
Q2.4,automation_style_25,Senior Researcher,"probably, automatic correction can be used. but that part is a pure engineering problem."
Q2.4,automation_style_26,Senior Researcher,"Everything listed expect removing commented out code, since it may be important and grouping."
Q2.4,automation_style_27,Open Source Developer,"We require comprehensive, clear documentation and strict, simple coding style. We have our own Android code guidelines and use Android coding guidelines for contributors as a basis. â€œClean Code: A Handbook of Agile Software Craftsmanshipâ€ (has recommendations on clean coding and code styling).

It would be great to have tools  able to answer the following questions automatically:

- did I have introduced imperfections at the level of documentation and coding style..?

Again, having the location (e.g., the set of files) where the problem was introduced would be relevant too.."
Q2.4,automation_style_28,Industrial Developer,"Let me say that I would like automated feedback on production and test code for quality issues (e.g.,  structure, coverage, suggestions on how to refactoring production and test code, etc.), documentation & coding style and possibly performance issues; Performance and Security issues

From one side code and code changes metrics + code change patters 
would a useful information to study previous changes in the software and its documentation to learn more about upcoming (and recurrent) mistakes.
I would mine this information with some data mining techniques and machine learning to learn these patterns and/or identify some of the problems.
Ont top of this, I think auto-fixing strategies could be envisioned.
"
Q2.4,automation_style_29,Senior Researcher,Make sure the code confirms to the project style
Q2.4,automation_style_30,Open Source Developer,"Tools like flake8 (python) or gometalinter (golang) and similar that detect flaws in source code.   Some of these can suggest fixes, or have companion tools (python: autopep8, golang: gofmt) that can automate these fixes."
Q2.4,automation_style_31,Industrial Developer,Whitespace and indentation. These can be very easily fixed.
Q2.4,automation_style_32,Other Occupation,N
Q2.4,automation_style_33,Industrial Developer,"i would use NLP analysis to study the coding style of the team/project, thus detect recurrent style issues (explaining what is wrong in my style), providing auto-fix solutions when possible.."
Q2.4,automation_style_34,Industrial Developer,as in the previous case:  some text mining and nlp analysis to detect patterns used o correct mistakes in the style.
Q2.4,automation_style_35,Industrial Developer,similar comments as before (detection and auto-fix).
Q2.4,automation_style_36,Industrial Developer,"i think tools like pmd, checkstyle alread y detect such problems, but are not always so accurate.."
Q2.4,automation_style_37,Industrial Developer,"i think tools for this already exists, find bugs, pmd , checkstyles.."
Q2.4,automation_style_38,Industrial Developer,a similar automation written before but based on static analysis.
Q2.4,automation_style_39,Industrial Developer, autofixes 
Q2.4,automation_style_40,Industrial Developer,detection of recurrent problems and auto-fixes (or recommendation of potential solutions?)
Q2.4,automation_style_41,Industrial Developer,Automaticly structure the code such that it confirms with the standards.
Q2.4,automation_style_42,Industrial Developer,something that give me feedback on the quality of my code.
Q2.4,automation_style_43,Industrial Developer,as in the previous answer
Q2.4,automation_style_44,Industrial Developer,"a comprehensive tool highlighting the changes to to perform or the defects introduced in the style, while introducing (or evolving) my patch"
Q2.4,automation_style_45,Industrial Developer,"I think style metrics, patterns or antipatterns in the code or in the documentation could be statically studied to determine things
-  to remove or changes (using the notion of antipatterns);
- things to adapt using the notion of patterns;
- detecting things that are inconsistent between documentation and the source code style (this would be really useful in our continuous delivery pipeline)"
Q2.4,automation_style_46,CS Student,not sure about it.
Q2.4,automation_style_47,Open Source Developer,not sure about this.
Q2.4,automation_style_48,Industrial Developer,"automation on detecting and fixing recurrent and relevant style issues
for my organization"
Q2.4,automation_style_49,Industrial Developer,  in all elements of the taxonomy
Q2.4,automation_style_50,Industrial Developer,NA
Q2.4,automation_style_51,Open Source Developer,do not know/do not want to say
Q2.4,automation_style_52,Industrial Developer,there are tools like check styles and pmd for java
Q2.5,automation_structure_1,Industrial Developer,"- medium term: provide statistics over code review changeset -> findings pairs to identify and track the main issues any given team has, finding recurring issues to improve on etc.
- in the longer term: every code review input and result should be fed into a machine learning system (neural networks, deep learning), in order to train it to detect a lot of the recurring issues within a given team."
Q2.5,automation_structure_2,Other Occupation,"I really do not understand the question; what do you mean by ""what kind of automation""? Sorry that I cannot be of any help here"
Q2.5,automation_structure_3,Industrial Developer,"Add missing modifiers like: static, final, public, private, etc.
Correct the case in names (camelCase, underscore_case)"
Q2.5,automation_structure_4,Other Occupation,Full
Q2.5,automation_structure_5,Senior Researcher,"In this case, the tool should assist the developers without automatically performing the changes."
Q2.5,automation_structure_6,CS Student,hint for code duplication
Q2.5,automation_structure_7,CS Student,"Naming, code flow, unused code detection, ..."
Q2.5,automation_structure_8,Open Source Developer,"Pattern detection with suggestion ->e.g. I see you build something which would be smart to structure in a factory pattern -> here my suggestion for it..

That would be really hard though to realise I guess, but cool"
Q2.5,automation_structure_9,Senior Researcher,automatic re-modularization tools
Q2.5,automation_structure_10,Senior Researcher,"structure: it would be also interesting to get feedback 
- on the introduced  duplicated-dead code, 
- test/code smells (bad design choices) added and/or overal test/code quality and readability in general. 
etc.

Maybe this could be done by analyzing code changes?"
Q2.5,automation_structure_11,Industrial Developer,"This is an incredibly difficult task (for C++).  There have been some attempts to create tools that could help you with being coherent to the C++ Core Guidelines (as well as modernize your code base), e.g. Cevelop that has been developed at HSR Rapperswil. Unfortunately, it works with Eclipse and based on the last Twitter poll it appears that few people are using it (because of Eclipse). "
Q2.5,automation_structure_12,Industrial Developer,"I suppose automation could, for example, warn about long methods, but I can't picture how to build a model for local convention ('Testing') or architect taste ('New Functionality')."
Q2.5,automation_structure_13,Other Occupation,Something aimed to propose a kind of refactoring of the actual code base
Q2.5,automation_structure_14,Senior Researcher,"Again I think I would expect a bit of everything. Although probably in the format of suggestions, for example, learning from past data and providing suggestions in the future? 

For example when I am about to commit class A, some features of class A (according to past data) indicates that class A should be moved to package B"
Q2.5,automation_structure_15,Industrial Developer,code coulping
Q2.5,automation_structure_16,CS Student,"Semantic dead code, semantic deduplication; more changes often require thorough review though"
Q2.5,automation_structure_17,CS Student,"highlight dead code, unreachable code, etc. suggest refactoring options (new functions or classes), suggest code that can be removed because of duplicates..."
Q2.5,automation_structure_18,Senior Researcher,None. Sorry. :)
Q2.5,automation_structure_19,Other Occupation,New functionality because is the harder thing to improve for the developers; most of the other branches of the taxonomy might be also supported by IDEs
Q2.5,automation_structure_20,Industrial Developer,Maybe refactoring suggestions based on coupling and cohesion metrics
Q2.5,automation_structure_21,Industrial Developer,"In this case, I would like to have a tool suggesting feedback on structural aspects according to any of types of artifacts I have in my patch: documentation, test and production code, etc. Possibly refactoring of tests not based only on coupling concepts but also ""incapsulating"" the need of having separated performance from functional testing and or having tests separated in  a way that they help to test different properties of microservices of cloud applications."
Q2.5,automation_structure_22,Senior Researcher,"as explained before I  I would try to understand which problems are recurrent in code reviews, e.g.,  defining patterns and anti-patterns characterizing the ""Structure issues"", then  defining solutions around it."
Q2.5,automation_structure_23,Senior Researcher,N.A
Q2.5,automation_structure_24,Industrial Developer,"I would expect  static tools profiling my changes my code and providing me feedback encapsulating aspects related to code (and test) structure, coding styles or other aspects. Clearly, even recommendations on the general required changes on a submitted patch would be really useful in my opinion."
Q2.5,automation_structure_25,Senior Researcher,code smell and its score indicating whether it is worthwhile to fix the smell.
Q2.5,automation_structure_26,Senior Researcher,Change function
Q2.5,automation_structure_27,Open Source Developer,"
It would be great to have tools  able to answer the following question automatically:

- did I have introduced imperfections at the level of Architecture patterns. ?

Again, having the location (e.g., the set of files) where the problem was introduced would be relevant too.."
Q2.5,automation_structure_28,Industrial Developer,"Let me say that I would like automated feedback on production and test code for quality issues (e.g.,  structure, coverage, suggestions on how to refactoring production and test code, etc.), documentation & coding style and possibly performance issues; Performance and Security issues

From one side code and code changes metrics + code change patters 
would a useful information to study previous changes in the software and its documentation to learn more about upcoming (and recurrent) mistakes.
I would mine this information with some data mining techniques and machine learning to learn these patterns and/or identify some of the problems.
Ont top of this, I think auto-fixing strategies could be envisioned.
"
Q2.5,automation_structure_29,Senior Researcher,Make sure there is no duplicates 
Q2.5,automation_structure_30,Open Source Developer,"Higher level tools like Sonarqube can detect these, but I find them to be less useful than human analysis."
Q2.5,automation_structure_31,Industrial Developer,"Dead code, duplicate code and redundant code."
Q2.5,automation_structure_32,Other Occupation,N
Q2.5,automation_structure_33,Industrial Developer,not sure here we need novel tool :)
Q2.5,automation_structure_34,Industrial Developer,as in the previous case:  some text mining and nlp analysis to detect patterns used o correct mistakes in the structure.
Q2.5,automation_structure_35,Industrial Developer,similar comments as before (detection and auto-fix).
Q2.5,automation_structure_36,Industrial Developer,"i think tools like pmd, checkstyle alread y detect such problems, but are not always so accurate.."
Q2.5,automation_structure_37,Industrial Developer,"i think tools for this already exists, find bugs, pmd , checkstyles.."
Q2.5,automation_structure_38,Industrial Developer,a similar automation written before but based on static analysis.
Q2.5,automation_structure_39,Industrial Developer, autofixes 
Q2.5,automation_structure_40,Industrial Developer,detection of recurrent problems and auto-fixes (or recommendation of potential solutions?)
Q2.5,automation_structure_41,Industrial Developer,Comment's concerning the given example in Solution Approach.
Q2.5,automation_structure_42,Industrial Developer,something that give me feedback on the structure of my documentation.
Q2.5,automation_structure_43,Industrial Developer,as in the previous answer.
Q2.5,automation_structure_44,Industrial Developer,"a comprehensive tool highlighting the changes to to perform or the defects introduced in the structure, while introducing (or evolving) my patch"
Q2.5,automation_structure_45,Industrial Developer,"As wrote before.

As recommendation, I think refactorings in Code reviews should not only consider the degree of cohesion and coupling between classes only, it should also consider the degree of comprehensibility of the test and production code.

Refactoring operations should be recommended in order to simplify the way the logic of the system is implemented (removing too complex branch and conditional statements, etc.). Thus, metrics modelling, readability,  logic and comprehensibility of implemented test and production code is something desirable.

Tool recommenting the files to potentially modify maybe also specifying the specific change to perform. I think this should be possible wish some historical analysis of changes.

Recomending reviewers according to their code ownership, the fact that they introduced previous similar changes (or similar structural or semantic clones).
Having reviwers that have implemented similar stuff would be useful to detect redundant/cloned/useless code to simplify it.

Tool to directly detect redundant/cloned/useless code to simplify it."
Q2.5,automation_structure_46,CS Student,not sure about it.
Q2.5,automation_structure_47,Open Source Developer,not sure about this.
Q2.5,automation_structure_48,Industrial Developer,"automation on detecting and fixing recurrent and relevant structure issues
for my organization"
Q2.5,automation_structure_49,Industrial Developer,  in all elements of the taxonomy
Q2.5,automation_structure_50,Industrial Developer,NA
Q2.5,automation_structure_51,Open Source Developer,do not know/do not want to say
Q2.5,automation_structure_52,Industrial Developer,there are tools like check styles and pmd for java
Q2.6,automation_topics_1,Industrial Developer,
